stock,headline,source,date,time,cleaned_headline,neg,neu,pos,compound,sentiment_label
TSLA,"Polestar Upgrades Model, Hits EV Production Milestone. Why Its Still Losing Ground to Tesla.",(Barrons.com),Aug-23-23,09:07AM,polestar upgrade model hit ev production milestone still losing ground tesla,0.167,0.833,0.0,-0.3818,Negative
TSLA,15 Highest Paying Countries for Engineers,(Insider Monkey),Aug-23-23,09:07AM,highest paying country engineer,0.0,1.0,0.0,0.0,Neutral
TSLA,Tesla's German plant lowers production target amid slower output - Business Insider,(Reuters),Aug-23-23,09:07AM,tesla german plant lower production target amid slower output business insider,0.13,0.87,0.0,-0.128,Negative
TSLA,"Down 9% in the Past 5 Days, Is Now the Right Time to Buy Bitcoin?",(Motley Fool),Aug-23-23,09:07AM,past day right time buy bitcoin,0.0,1.0,0.0,0.0,Neutral
TSLA,Tesla's German plant lowers production target amid slower output - Business Insider,(Reuters),Aug-23-23,09:07AM,tesla german plant lower production target amid slower output business insider,0.13,0.87,0.0,-0.128,Negative
TSLA,"Malaysia was so eager to get Elon Musk to invest in the country, it waived its decades-old policies for Tesla",(Fortune),Aug-23-23,09:07AM,malaysia eager get elon musk invest country waived decadesold policy tesla,0.0,0.854,0.146,0.5009,Positive
TSLA,Buying These 2 Stocks Could Be the Smartest Investing Move You Ever Make,(Motley Fool),Aug-23-23,09:07AM,buying stock could smartest investing move ever make,0.0,0.733,0.267,0.6124,Positive
TSLA,Is Nvidia the New Tesla? Options Traders Place Their Bets,(The Wall Street Journal),Aug-23-23,09:07AM,nvidia new tesla option trader place bet,0.0,1.0,0.0,0.0,Neutral
TSLA,"How to Trade an Uncertain China: Buy Qualcomm Stock, Sell Tesla",(Barrons.com),Aug-23-23,09:07AM,trade uncertain china buy qualcomm stock sell tesla,0.18,0.82,0.0,-0.296,Negative
TSLA,Graphite Wars: The Trillion Dollar Battery Race Has A Big Problem,(Oilprice.com),Aug-22-23,07:01PM,graphite war trillion dollar battery race big problem,0.441,0.559,0.0,-0.743,Negative
TSLA,"Car buyers feeling the pinch of higher prices, payments",(Yahoo Finance Video),Aug-22-23,07:01PM,car buyer feeling pinch higher price payment,0.0,0.842,0.158,0.128,Positive
TSLA,Hot new bad idea,(Financial Times),Aug-22-23,07:01PM,hot new bad idea,0.538,0.462,0.0,-0.5423,Negative
TSLA,Tesla Rebound Hits Resistance As Another Executive Steps Down,(Investor's Business Daily),Aug-22-23,07:01PM,tesla rebound hit resistance another executive step,0.0,1.0,0.0,0.0,Neutral
TSLA,Tesla is testing a new feature that may be extremely helpful (especially in these areas),(TheStreet.com),Aug-22-23,07:01PM,tesla testing new feature may extremely helpful especially area,0.0,0.808,0.192,0.4754,Positive
TSLA,Tesla to lease huge warehouses in Kyle,(American City Business Journals),Aug-22-23,07:01PM,tesla lease huge warehouse kyle,0.0,0.723,0.277,0.3182,Positive
TSLA,Rishi Sunak to woo Elon Musk after Tesla billionaires meetings with Macron,(The Telegraph),Aug-22-23,07:01PM,rishi sunak woo elon musk tesla billionaire meeting macron,0.0,0.78,0.22,0.4767,Positive
TSLA,Today's EV Updates,(Benzinga),Aug-22-23,07:01PM,today ev update,0.0,1.0,0.0,0.0,Neutral
TSLA,Has Nvidia become the new Tesla for markets?,(Yahoo Finance Video),Aug-22-23,07:01PM,nvidia become new tesla market,0.0,1.0,0.0,0.0,Neutral
TSLA,"Tesla Stock Surges on Cybertruck Launch, Model 3 Refresh",(Zacks),Aug-22-23,07:01PM,tesla stock surge cybertruck launch model refresh,0.0,1.0,0.0,0.0,Neutral
TSLA,Tesla Stock Has Been Dead Money for Some Investors,(Barrons.com),Aug-22-23,07:01PM,tesla stock dead money investor,0.35,0.65,0.0,-0.6486,Negative
TSLA,Elon Musk takes a jab at Tesla's competitors,(TheStreet.com),Aug-22-23,07:01PM,elon musk take jab tesla competitor,0.0,1.0,0.0,0.0,Neutral
TSLA,Tesla Rebound Gathers Momentum After Q2 Selloff; Are China Concerns Overblown?,(Investor's Business Daily),Aug-22-23,07:01PM,tesla rebound gather momentum q selloff china concern overblown,0.0,1.0,0.0,0.0,Neutral
TSLA,Texas Mandates Tesla's (TSLA) NACS Plugs for New Stations,(Zacks),Aug-22-23,07:01PM,texas mandate tesla tsla nac plug new station,0.0,1.0,0.0,0.0,Neutral
TSLA,3 Catalysts to Take Tesla Stock to $300,(Motley Fool),Aug-22-23,07:01PM,catalyst take tesla stock,0.0,1.0,0.0,0.0,Neutral
TSLA,"Prediction: 3 Unstoppable Stocks Set to Join Apple, Microsoft, Amazon, Alphabet, and Nvidia in the $1 Trillion Club by 2030",(Motley Fool),Aug-22-23,07:01PM,prediction unstoppable stock set join apple microsoft amazon alphabet nvidia trillion club,0.083,0.737,0.18,0.2732,Positive
TSLA,"Tesla Stock Snapped Its Losing Streak. These Catalysts Are Helping, Says Analyst.",(Barrons.com),Aug-21-23,04:39PM,tesla stock snapped losing streak catalyst helping say analyst,0.176,0.676,0.149,-0.1027,Negative
TSLA,"S&P 500: Cybersecurity Giant Soars On Earnings; Tesla, Nvidia Are Big Winners",(Investor's Business Daily),Aug-21-23,04:39PM,sp cybersecurity giant soar earnings tesla nvidia big winner,0.0,0.78,0.22,0.4767,Positive
TSLA,Stock Market Today: Tech Stocks Soar as Bargain Hunters Swoop In,(Kiplinger),Aug-21-23,04:39PM,stock market today tech stock soar bargain hunter swoop,0.0,0.847,0.153,0.2023,Positive
TSLA,"Tesla Bounces Back As Cybertruck, New Model 3 Excitement Take Over; Is TSLA's Slide Over?",(Investor's Business Daily),Aug-21-23,04:39PM,tesla bounce back cybertruck new model excitement take tslas slide,0.0,0.802,0.198,0.4939,Positive
TSLA,"Tesla stock rises, AMC's stock conversion: Trending stocks",(Yahoo Finance Video),Aug-21-23,04:39PM,tesla stock rise amcs stock conversion trending stock,0.0,1.0,0.0,0.0,Neutral
TSLA,Tesla says two ex-employees behind May data breach,(Reuters),Aug-21-23,04:39PM,tesla say two exemployees behind may data breach,0.0,1.0,0.0,0.0,Neutral
TSLA,Tesla facility in Baltimore County to lay off 55 workers,(American City Business Journals),Aug-21-23,04:39PM,tesla facility baltimore county lay worker,0.0,1.0,0.0,0.0,Neutral
TSLA,"Meta's Threads Prepares To Counter Elon Musk's X, Tesla Data Breach Affects Over 75K People, Medical Properties Trust's Prospect Medical Deal On Hold: Today's Top Stories",(Benzinga),Aug-21-23,04:39PM,metas thread prepares counter elon musk x tesla data breach affect k people medical property trust prospect medical deal hold today top story,0.0,0.857,0.143,0.4588,Positive
TSLA,Electric vehicles hitting legislative speed bumps in several states,(TheStreet.com),Aug-21-23,04:39PM,electric vehicle hitting legislative speed bump several state,0.0,1.0,0.0,0.0,Neutral
TSLA,Why Tesla Stock Might Break Its Losing Streak Today,(Motley Fool),Aug-21-23,04:39PM,tesla stock might break losing streak today,0.245,0.755,0.0,-0.3818,Negative
TSLA,Electric Pickups Are Upleveling The Power Of EVs,(Benzinga),Aug-21-23,04:39PM,electric pickup upleveling power ev,0.0,1.0,0.0,0.0,Neutral
TSLA,Is Tesla Inc (TSLA) Significantly Undervalued? A Comprehensive Valuation Analysis,(GuruFocus.com),Aug-21-23,04:39PM,tesla inc tsla significantly undervalued comprehensive valuation analysis,0.0,0.8,0.2,0.25,Positive
TSLA,Why investors may not need to worry too much about China's economy,(Yahoo Finance Video),Aug-21-23,04:39PM,investor may need worry much china economy,0.0,0.821,0.179,0.3412,Positive
TSLA,How Kevin O'Leary's son talked him into buying Tesla stock,(TheStreet.com),Aug-21-23,04:39PM,kevin olearys son talked buying tesla stock,0.0,1.0,0.0,0.0,Neutral
TSLA,"Tesla Stock Is Set to Snap Its Losing Streak. These Catalysts Will Help, Says Analyst.",(Barrons.com),Aug-21-23,04:39PM,tesla stock set snap losing streak catalyst help say analyst,0.142,0.71,0.148,0.0258,Positive
TSLA,"Tesla's Employee Data Leak, Full Self-Driving Problem and Using Siri for Car Commands: Top Stories For Elon Musk Led EV Company Today",(Benzinga),Aug-21-23,04:39PM,tesla employee data leak full selfdriving problem using siri car command top story elon musk led ev company today,0.197,0.734,0.069,-0.5106,Negative
TSLA,"Investors Heavily Search Tesla, Inc. (TSLA): Here is What You Need to Know",(Zacks),Aug-21-23,04:39PM,investor heavily search tesla inc tsla need know,0.0,1.0,0.0,0.0,Neutral
TSLA,Global EV Market Share by Company: Top 15 Companies,(Insider Monkey),Aug-21-23,04:39PM,global ev market share company top company,0.0,0.636,0.364,0.4588,Positive
TSLA,9 Plunging Stocks Suffer 50% Of S&P 500's $2 Trillion Meltdown,(Investor's Business Daily),Aug-21-23,04:39PM,plunging stock suffer sp trillion meltdown,0.28,0.72,0.0,-0.5423,Negative
TSLA,"Down 21% in the Last Month, Is Tesla Stock a Buy Now?",(Motley Fool),Aug-21-23,04:39PM,last month tesla stock buy,0.0,1.0,0.0,0.0,Neutral
TSLA,Shanghai free trade zone vows 2-hour approvals for 'high-growth' projects to woo foreign capital as China's inward investments slump,(South China Morning Post),Aug-21-23,04:39PM,shanghai free trade zone vow hour approval highgrowth project woo foreign capital china inward investment slump,0.0,0.726,0.274,0.7506,Positive
TSLA,3 Stock-Split Stocks Billionaires Are Selling and the 1 Surprising Stock-Split Stock They're Piling Into,(Motley Fool),Aug-21-23,04:39PM,stocksplit stock billionaire selling surprising stocksplit stock theyre piling,0.0,0.851,0.149,0.2732,Positive
TSLA,"Palo Alto, Tesla, Nvidia rise premarket; Napco, Nikola fall",(Investing.com),Aug-21-23,04:39PM,palo alto tesla nvidia rise premarket napco nikola fall,0.0,1.0,0.0,0.0,Neutral
TSLA,"Tesla Data Breach Blamed on Insider Wrongdoing Impacted 75,000",(Bloomberg),Aug-20-23,05:13PM,tesla data breach blamed insider wrongdoing impacted,0.279,0.721,0.0,-0.4767,Negative
TSLA,Michael Burrys Top 10 Stock Picks For Q3,(Insider Monkey),Aug-20-23,05:13PM,michael burrys top stock pick q,0.0,0.795,0.205,0.2023,Positive
TSLA,Texas mandates new EV charging stations use the Tesla NACS plug,(Autoblog),Aug-20-23,05:13PM,texas mandate new ev charging station use tesla nac plug,0.0,1.0,0.0,0.0,Neutral
TSLA,Cathie Wood Just Sold Tesla and Shopify -- and Bought This Potentially Explosive Growth Stock,(Motley Fool),Aug-20-23,05:13PM,cathie wood sold tesla shopify bought potentially explosive growth stock,0.0,0.843,0.157,0.3818,Positive
TSLA,Tesla continues waging price war; VinFast makes U.S. debut: This week in EVs,(Investing.com),Aug-20-23,05:13PM,tesla continues waging price war vinfast make u debut week ev,0.245,0.755,0.0,-0.5994,Negative
TSLA,This week in tech: Analysts sweet on Nvidia; Tesla cuts prices again,(Investing.com),Aug-20-23,05:13PM,week tech analyst sweet nvidia tesla cut price,0.145,0.658,0.197,0.2023,Positive
TSLA,"Tesla data breach affects 75,735 people, state attorney general announces",(Fox Business),Aug-19-23,12:48PM,tesla data breach affect people state attorney general announces,0.0,1.0,0.0,0.0,Neutral
TSLA,Good News for Tesla Investors. Bad News for Tesla Stock.,(Motley Fool),Aug-19-23,12:48PM,good news tesla investor bad news tesla stock,0.243,0.556,0.201,-0.1531,Negative
TSLA,2 Unstoppable Stocks That Could Join the $1 Trillion Club,(Motley Fool),Aug-19-23,12:48PM,unstoppable stock could join trillion club,0.164,0.636,0.2,0.1027,Positive
TSLA,Elon Musks Latest Antics Have Some Asking: Is He Out of Touch?,(The Wall Street Journal),Aug-19-23,12:48PM,elon musk latest antic asking touch,0.0,1.0,0.0,0.0,Neutral
TSLA,Best Stocks to Buy: Tesla Stock vs. Ford Stock,(Motley Fool),Aug-19-23,12:48PM,best stock buy tesla stock v ford stock,0.0,0.656,0.344,0.6369,Positive
TSLA,Tesla Stock Went Down Again for a New Reason. Heres Where Its Going.,(Barrons.com),Aug-18-23,05:17PM,tesla stock went new reason here going,0.0,1.0,0.0,0.0,Neutral
TSLA,These Are The 5 Best EV Stocks To Buy And Watch Now,(Investor's Business Daily),Aug-18-23,05:17PM,best ev stock buy watch,0.0,0.704,0.296,0.6369,Positive
TSLA,XPeng Stock Tumbles. Something Other Than Earnings Is Leading It Lower.,(Barrons.com),Aug-18-23,05:17PM,xpeng stock tumble something earnings leading lower,0.18,0.82,0.0,-0.296,Negative
TSLA,Tesla proposes 3rd service and sales center in Miami-Dade,(American City Business Journals),Aug-18-23,05:17PM,tesla proposes rd service sale center miamidade,0.0,1.0,0.0,0.0,Neutral
TSLA,Tesla Stock Is Down Again for a New Reason. Heres Where Its Going.,(Barrons.com),Aug-18-23,05:17PM,tesla stock new reason here going,0.0,1.0,0.0,0.0,Neutral
TSLA,XPeng Succumbed To Tesla's Price War But Rising Deliveries Provide Hints Of Recovery,(Benzinga),Aug-18-23,05:17PM,xpeng succumbed tesla price war rising delivery provide hint recovery,0.17,0.83,0.0,-0.3506,Negative
TSLA,Is Tesla (TSLA) a Hidden Gem? A Deep Dive into its Valuation and Financial Health,(GuruFocus.com),Aug-18-23,05:17PM,tesla tsla hidden gem deep dive valuation financial health,0.0,1.0,0.0,0.0,Neutral
TSLA,Elon Musk's SpaceX reportedly turned a profit in Q1,(Yahoo Finance Video),Aug-18-23,05:17PM,elon musk spacex reportedly turned profit q,0.0,0.707,0.293,0.4404,Positive
TSLA,Tesla (TSLA) Down 16.6% Since Last Earnings Report: Can It Rebound?,(Zacks),Aug-18-23,05:17PM,tesla tsla since last earnings report rebound,0.0,1.0,0.0,0.0,Neutral
TSLA,Shares Of Chinese EV Maker Xpeng Slide on Earnings Loss,(Investopedia),Aug-18-23,05:17PM,share chinese ev maker xpeng slide earnings loss,0.184,0.64,0.176,-0.0258,Negative
TSLA,Stock Market Correction Takes Hold As Treasury Yields Hit 15-Year High: Weekly Review,(Investor's Business Daily),Aug-18-23,05:17PM,stock market correction take hold treasury yield hit year high weekly review,0.0,0.87,0.13,0.2023,Positive
TSLA,Why your new electric car won't have a spare tire. And why you probably don't need one,(LA Times),Aug-18-23,05:17PM,new electric car wont spare tire probably dont need one,0.0,1.0,0.0,0.0,Neutral
TSLA,"Zacks Investment Ideas feature highlights: Chicago Mercantile Exchange, Nvidia, Microsoft and Tesla",(Zacks),Aug-18-23,05:17PM,zacks investment idea feature highlight chicago mercantile exchange nvidia microsoft tesla,0.0,1.0,0.0,0.0,Neutral
TSLA,XPeng Stock Tumbles on Wider-Than-Expected Loss,(Barrons.com),Aug-18-23,05:17PM,xpeng stock tumble widerthanexpected loss,0.315,0.685,0.0,-0.3182,Negative
TSLA,Bitcoin Could Fall Another 25%. Will Elon Musk and SpaceX Be to Blame?,(Barrons.com),Aug-18-23,05:17PM,bitcoin could fall another elon musk spacex blame,0.167,0.833,0.0,-0.34,Negative
TSLA,3 Hot Stocks That Could Live Up to Their Lofty Valuations,(Motley Fool),Aug-18-23,05:17PM,hot stock could live lofty valuation,0.0,1.0,0.0,0.0,Neutral
TSLA,Elon Musk Arrives in Japan for First Visit in Nine Years,(Bloomberg),Aug-17-23,11:35PM,elon musk arrives japan first visit nine year,0.0,1.0,0.0,0.0,Neutral
TSLA,Bitcoin falls nearly 8% as cryptocurrency slide continues,(Financial Times),Aug-17-23,11:35PM,bitcoin fall nearly cryptocurrency slide continues,0.935,0.065,0.0,-0.9993,Negative
TSLA,Elon Musk Says One Of The Most Difficult Choices He Ever Had To Make Was When He Had 'Just $30 Million Left',(Benzinga),Aug-17-23,11:35PM,elon musk say one difficult choice ever make million left,0.117,0.883,0.0,-0.4201,Negative
TSLA,XPengs Earnings Should Be Wild. Theyll Matter for Tesla.,(Barrons.com),Aug-17-23,11:35PM,xpengs earnings wild theyll matter tesla,0.0,0.879,0.121,0.0258,Positive
TSLA,Tesla Logged Another EV Charging Win in Texas. The Stock Didnt Go Up.,(Barrons.com),Aug-17-23,11:35PM,tesla logged another ev charging win texas stock didnt go,0.0,0.759,0.241,0.5859,Positive
TSLA,VinFast Stock Falls for Second Day; Chinese EV Shares Rise,(The Wall Street Journal),Aug-17-23,11:35PM,vinfast stock fall second day chinese ev share rise,0.908,0.072,0.02,-0.9992,Negative
TSLA,Tesla warns Core Lithium of potential lawsuit over failed deal,(Reuters),Aug-17-23,11:35PM,tesla warns core lithium potential lawsuit failed deal,0.485,0.515,0.0,-0.6808,Negative
TSLA,"Blue Shield of California Ends CVS Caremark Partnership, Google's Verily Life Sciences Intensifies Cost-Cutting, Tesla's Autopilot Under Fire Again: Today's Top Stories",(Benzinga),Aug-17-23,11:35PM,blue shield california end cv caremark partnership google verily life science intensifies costcutting tesla autopilot fire today top story,0.099,0.826,0.074,-0.1531,Negative
TSLA,Is Rivian Stock A Buy Or A Sell With Tesla Launching Cheaper Model S and Model X?,(Investor's Business Daily),Aug-17-23,11:35PM,rivian stock buy sell tesla launching cheaper model model x,0.0,1.0,0.0,0.0,Neutral
TSLA,Why earnings beats haven't been good enough for investors,(Yahoo Finance Video),Aug-17-23,11:35PM,earnings beat havent good enough investor,0.156,0.454,0.389,0.6802,Positive
TSLA,Tesla employees discuss what they call the brutal reality of working for Elon Musk,(TheStreet.com),Aug-17-23,11:35PM,tesla employee discus call brutal reality working elon musk,0.24,0.76,0.0,-0.6249,Negative
TSLA,Is Tesla Stock A Buy Or A Sell With This Analyst Saying TSLA Is A 'Table Pounder'?,(Investor's Business Daily),Aug-17-23,11:35PM,tesla stock buy sell analyst saying tsla table pounder,0.0,1.0,0.0,0.0,Neutral
TSLA,Tesla Cuts Prices in China as Price-War Truce Fails,(The Wall Street Journal),Aug-17-23,11:35PM,tesla cut price china pricewar truce fails,0.417,0.583,0.0,-0.6124,Negative
TSLA,Tesla Stock Is Up. It Logged Another EV Charging Win in Texas.,(Barrons.com),Aug-17-23,11:35PM,tesla stock logged another ev charging win texas,0.0,0.743,0.257,0.5859,Positive
TSLA,Tesla Warns Miner of Possible Legal Claim on Failed Supply Talks,(Bloomberg),Aug-17-23,11:35PM,tesla warns miner possible legal claim failed supply talk,0.331,0.563,0.106,-0.4939,Negative
TSLA,Tesla's Charging Deal Isn't as Good as It Seems,(Motley Fool),Aug-17-23,11:35PM,tesla charging deal isnt good seems,0.231,0.769,0.0,-0.3412,Negative
TSLA,"2 Artificial Intelligence (AI) Stocks Billionaires Are Aggressively Selling, and 1 AI Leader They Can't Stop Buying",(Motley Fool),Aug-17-23,11:35PM,artificial intelligence ai stock billionaire aggressively selling ai leader cant stop buying,0.119,0.622,0.259,0.3995,Positive
TSLA,EV Maker VinFast Bags Huge Valuation in SPAC-Mania Redux,(Motley Fool),Aug-16-23,08:00PM,ev maker vinfast bag huge valuation spacmania redux,0.0,0.777,0.223,0.3182,Positive
TSLA,"EV Startup VinFasts Market Debut Pushes Value Higher Than GM, Ford",(The Wall Street Journal),Aug-16-23,08:00PM,ev startup vinfasts market debut push value higher gm ford,0.0,0.806,0.194,0.34,Positive
TSLA,Elon Musk says SpaceX using Starlink to aid Maui wildfire recovery,(Fox Business),Aug-16-23,08:00PM,elon musk say spacex using starlink aid maui wildfire recovery,0.0,1.0,0.0,0.0,Neutral
TSLA,Ford CEO Jim Farley Test Drives an F-150 Lightning and Sees a Problem,(Observer),Aug-16-23,08:00PM,ford ceo jim farley test drive f lightning see problem,0.197,0.803,0.0,-0.4019,Negative
TSLA,NYC To Boston After 10-Minute Charge? Tesla Supplier Launches New Battery,(Investor's Business Daily),Aug-16-23,08:00PM,nyc boston minute charge tesla supplier launch new battery,0.0,1.0,0.0,0.0,Neutral
TSLA,Tesla Extends Slide On Latest China EV Price War Offensive; Cathie Wood Keeps Selling TSLA,(Investor's Business Daily),Aug-16-23,08:00PM,tesla extends slide latest china ev price war offensive cathie wood keep selling tsla,0.338,0.588,0.074,-0.7506,Negative
TSLA,Mark Cuban takes another jab at Elon Musk' s business practices,(TheStreet.com),Aug-16-23,08:00PM,mark cuban take another jab elon musk business practice,0.0,1.0,0.0,0.0,Neutral
TSLA,"Tesla cuts Model S, Model X prices in China",(Yahoo Finance Video),Aug-16-23,08:00PM,tesla cut model model x price china,0.239,0.761,0.0,-0.296,Negative
NIO,Graphite Wars: The Trillion Dollar Battery Race Has A Big Problem,(Oilprice.com),Aug-22-23,07:01PM,graphite war trillion dollar battery race big problem,0.441,0.559,0.0,-0.743,Negative
NIO,Global EV Market Share by Company: Top 15 Companies,(Insider Monkey),Aug-21-23,08:49AM,global ev market share company top company,0.0,0.636,0.364,0.4588,Positive
NIO,NIO Inc. (NIO) Gains As Market Dips: What You Should Know,(Zacks),Aug-17-23,05:45PM,nio inc nio gain market dip know,0.0,0.806,0.194,0.34,Positive
NIO,VinFast Stock Falls for Second Day; Chinese EV Shares Rise,(The Wall Street Journal),Aug-17-23,05:45PM,vinfast stock fall second day chinese ev share rise,0.908,0.072,0.02,-0.9992,Negative
NIO,VinFast Stock Plunges After EV Maker's Blockbuster Nasdaq Debut,(The Wall Street Journal),Aug-16-23,09:52AM,vinfast stock plunge ev maker blockbuster nasdaq debut,0.0,0.672,0.328,0.5994,Positive
NIO,"NIO Inc. to Report Second Quarter 2023 Financial Results on Tuesday, August 29, 2023",(GlobeNewswire),Aug-16-23,09:52AM,nio inc report second quarter financial result tuesday august,0.0,1.0,0.0,0.0,Neutral
NIO,Investors Heavily Search NIO Inc. (NIO): Here is What You Need to Know,(Zacks),Aug-15-23,01:43PM,investor heavily search nio inc nio need know,0.0,1.0,0.0,0.0,Neutral
NIO,The 3 Most Undervalued EV Stocks to Buy Now: August 2023,(InvestorPlace),Aug-15-23,01:43PM,undervalued ev stock buy august,0.0,1.0,0.0,0.0,Neutral
NIO,"Tesla Stock Falls After China Price Cuts, Local EV Rivals Also Drop",(The Wall Street Journal),Aug-14-23,12:55PM,tesla stock fall china price cut local ev rival also drop,0.921,0.079,0.0,-0.9993,Negative
NIO,Tesla stock falls after slashing some Model Y prices in China,(Yahoo Finance Video),Aug-14-23,12:55PM,tesla stock fall slashing model price china,0.928,0.072,0.0,-0.9993,Negative
NIO,"Tesla Stock Falls on China Price Cuts, Local EV Rivals Also Drop",(The Wall Street Journal),Aug-14-23,12:55PM,tesla stock fall china price cut local ev rival also drop,0.921,0.079,0.0,-0.9993,Negative
NIO,NIO Inc. (NIO) Stock Sinks As Market Gains: What You Should Know,(Zacks),Aug-10-23,05:45PM,nio inc nio stock sink market gain know,0.0,0.821,0.179,0.34,Positive
NIO,NIO Stock Revival? Why This EV Giant May Still Be Revving Up.,(InvestorPlace),Aug-10-23,05:45PM,nio stock revival ev giant may still revving,0.0,1.0,0.0,0.0,Neutral
NIO,U.S. judge greenlights Nio investor class action over factory claims,(Reuters),Aug-09-23,11:58AM,u judge greenlights nio investor class action factory claim,0.0,1.0,0.0,0.0,Neutral
NIO,"Nio: Buy, Sell, or Hold?",(Motley Fool),Aug-08-23,07:30AM,nio buy sell hold,0.0,1.0,0.0,0.0,Neutral
NIO,"Reaching The Finish Line Of The EV Race Is A Daunting Task, One That Some Won't Be Able To Accomplish",(Benzinga),Aug-07-23,05:08PM,reaching finish line ev race daunting task one wont able accomplish,0.0,0.787,0.213,0.5574,Positive
NIO,"Chinese Maker of 1,000 Kilometer EV Battery Plans IPO by 2025",(Bloomberg),Aug-06-23,06:00PM,chinese maker kilometer ev battery plan ipo,0.0,1.0,0.0,0.0,Neutral
NIO,A $15 Billion Electric Vehicle Niche Is Flying Under Wall Streets Radar,(Oilprice.com),Aug-02-23,07:00PM,billion electric vehicle niche flying wall street radar,0.0,1.0,0.0,0.0,Neutral
NIO,Better Chinese Growth Stock: Nio vs. Bilibili,(Motley Fool),Aug-02-23,07:00PM,better chinese growth stock nio v bilibili,0.0,0.476,0.524,0.6705,Positive
NIO,"NIO Inc. Announces that Deliveries in July 2023 Reached 20,462 Vehicles",(GlobeNewswire),Aug-01-23,05:30AM,nio inc announces delivery july reached vehicle,0.0,0.877,0.123,0.1027,Positive
NIO,Nio Hits the Accelerator: Can The Stock Make a Long Distance Trip?,(TheStreet.com),Jul-31-23,02:24PM,nio hit accelerator stock make long distance trip,0.0,1.0,0.0,0.0,Neutral
NIO,Why Nio Stock Is Accelerating Higher Today,(Motley Fool),Jul-28-23,02:38PM,nio stock accelerating higher today,0.0,1.0,0.0,0.0,Neutral
NIO,"Why Nio and QuantumScape Shares Soared, but Canoo Dropped This Week",(Motley Fool),Jul-27-23,02:19PM,nio quantumscape share soared canoo dropped week,0.0,0.862,0.138,0.1531,Positive
NIO,"Hey, NIO Investors! This EV Stock Has Trouble Written All Over It.",(InvestorPlace),Jul-27-23,02:19PM,hey nio investor ev stock trouble written,0.507,0.493,0.0,-0.9359,Negative
NIO,"Why Shares of Rivian, Lucid, and Nio Popped Today",(Motley Fool),Jul-26-23,02:46PM,share rivian lucid nio popped today,0.0,0.784,0.216,0.296,Positive
NIO,3 EV Stocks to Buy Before the Breakout,(InvestorPlace),Jul-26-23,02:46PM,ev stock buy breakout,0.0,1.0,0.0,0.0,Neutral
NIO,Dont Read Too Much Into the Latest NIO Stock News,(InvestorPlace),Jul-26-23,02:46PM,dont read much latest nio stock news,0.0,1.0,0.0,0.0,Neutral
NIO,3 Under-The-Radar EV Stocks For A Summer Of Disruption,(Oilprice.com),Jul-25-23,07:00PM,undertheradar ev stock summer disruption,0.294,0.706,0.0,-0.3612,Negative
NIO,Here is What to Know Beyond Why NIO Inc. (NIO) is a Trending Stock,(Zacks),Jul-25-23,07:00PM,know beyond nio inc nio trending stock,0.0,1.0,0.0,0.0,Neutral
NIO,10 Sustainable Investing Stocks Billionaires Are Loading Up On,(Insider Monkey),Jul-24-23,08:30PM,sustainable investing stock billionaire loading,0.0,1.0,0.0,0.0,Neutral
NIO,Analyst Report: NIO Inc.,(Morningstar Research),Jul-24-23,08:30PM,analyst report nio inc,0.0,1.0,0.0,0.0,Neutral
NIO,Why Nio Stock Is Racing Higher Today,(Motley Fool),Jul-24-23,08:30PM,nio stock racing higher today,0.0,1.0,0.0,0.0,Neutral
NIO,Keep NIO Stock on Your Watch List But Dont Buy Yet,(InvestorPlace),Jul-24-23,08:30PM,keep nio stock watch list dont buy yet,0.0,1.0,0.0,0.0,Neutral
NIO,3 EV Stocks That Are Screaming Buys Right Now: July 2023,(InvestorPlace),Jul-21-23,10:00PM,ev stock screaming buy right july,0.224,0.776,0.0,-0.3818,Negative
NIO,"Tesla stock is worth only $85 after gross margin whiff, analyst says: Wall Street reacts",(Yahoo Finance),Jul-20-23,04:55AM,tesla stock worth gross margin whiff analyst say wall street reacts,0.172,0.722,0.106,-0.296,Negative
NIO,Here's 1 Thing Smart Investors Know About Nio Stock,(Motley Fool),Jul-20-23,04:55AM,here thing smart investor know nio stock,0.0,0.722,0.278,0.4019,Positive
